gemeente|data|titel|klasse
58c16d1dbb59056809b91917|Eerste termijn college, tweede termijn raad, tweede termijn college.    Volgorde fracties conform loting:  1. D66  2. LHN  3. Zoetermeer Vooruit  4. CU-SGP  5. PvdA  6. CDA  7. GroenLinks  8. Zó! Zoetermeer  9. VVD  10. SP    |11: Tweede tussenbericht 2016 & Programmabegroting 2017-2020|Agendapunt
gemeente-den-helder-den-helder-nh|De Rekenkamercommissie Den Helder heeft onderzoek uitgevoerd naar de opvolging van aanbevelingen van het onderzoek naar de HVC uit 2014. Uit het onderzoek, dat gezamenlijk met meerdere gemeenten is uitgevoerd, blijkt dat de aanbevelingen niet of nauwelijks door de colleges zijn uitgevoerd. Het presidium van de gemeenteraad stelt thans - op aangeven van de Rekenkamercommissie - voor het college van burgemeester en wethouders op te dragen een concreet plan van aanpak op te stellen en deze ter kennisname van de raad te brengen. De commissie dient de raad te adviseren over het voorstel.|5. Voorstel over de opvolging van aanbevelingen van het onderzoek naar HVC.|Agendapunt
58c16d1dbb59056809b91917|Spreekrecht   - Mevrouw G. van Haaster over de lichtreclame van het Beren restaurant.   - Dhr. E. Tan over het zwembad en het spreekrecht.   - Dhr. J. den Dulk over verhoging inkomsten maaiveld parkeren.|2: Spreekrecht|Agendapunt
commissie-stad|Naar aanleiding van de gesignaleerde onvrede onder bewoners en omwonenden van het gebied Voorweg-Noord over het gevolgde proces bij de voorbereiding van het bestemmingsplan voor dit gebied heeft het presidium voorgesteld een bijeenkomst te organiseren, waarbij de bewoners hun mening kunnen geven over het proces tot nu toe en de aanpassingen die het college inmiddels heeft aangebracht.   Het doel van de bijeenkomst is om a. te leren van evt. fouten in het eerdere samenspraaktraject en b. na te gaan of de voorgestelde wijzingen op steun van de bewoners kunnen rekenen.|I: Bijeenkomst bewoners Voorweg |Agendapunt
gemeente-den-helder-den-helder-nh|1.  Opening en mededelingen   2.  Spreekrecht burgers   3.  Vaststelling agenda   4.  Voorstel tot het vaststellen van het beleidskader cultureel erfgoed 'Oog voor het verleden, visie op de toekomst'en de Erfgoedverordening gemeente Den Helder 2017.  Het beleidskader vormt het kader voor de gemeentelijke inzet op behoud en ontwikkeling van het erfgoed. In het kader wordt eerst een korte geschiedenis beschreven, daarna worden de ijkpunten van het cultureel erfgoed benoemd. Vervolgens wordt ingegaan op wat de gemeente wil met haar cultureel erfgoed, hoe ze dat wil bereiken en de rol van de gemeente en vrijwilligers. De Erfgoedverordening vormt het wettelijk kader voor bescherming. De commissie dient de raad te adviseren over het voorstel. 5.  Voorstel tot het vaststellen van het bestemmingsplan Willem Alexanderhof, uitbreiding fase 4.1 2017.  De wijk Willem Alexanderhof is nog in ontwikkeling. In het bestemmingsplan Julianadorp Oost 2011 zijn zes uitwerkingsgebieden opgenomen voor grond die na het vaststellen van het bestemmingsplan nader ingevuld worden. Het thans voorliggende bestemmingsplan voorziet in het ontwikkelen van de noordoost zijde van Willem-Alexanderhof en geeft invulling aan een tweetal van de eerder genoemde uitwerkingsgebieden. Het voorziet in het planologisch-juridisch kader voor de ontwikkeling van maximaal 62 grondgebonden woningen aan de noordzijde van de wijk. De commissie dient de raad te adviseren over het voorstel. 6.  Voorstel tot het vaststellen van het beleidsplan 'Ruimte voor water, gezamenlijk gemeentelijk rioleringsplan Noordkop 2018-2022.  Gemeenten zijn verplicht de zorgtaken voor afval-, hemel- en grondwater alsmede de onderbouwing van het tarief voor rioolheffing vast te leggen. Het voorliggende beleidsplan voorziet hierin. In het plan wordt aangegeven welke richting de gemeente op wil in de planperiode 2018-2022 en wordt een visie gegeven op de verdere toekomst. Door de vervangingsinvesteringen te activeren, kunnen de gelden in de rioolvoorziening worden benut voor de dekking van investeringen voor de zorgplichten hemel- en grondwater. Hierdoor kunnen de financiële consequenties voor de inwoners en bedrijven beperkt blijven. De commissie dient de raad te adviseren over het voorstel. 7.  Sluiting  |Verslag 7. Sluiting|Verslag
58c16d1dbb59056809b91917|Vervoersknoop Bleizo (2014-000772) (oordeelsvormend) (50 minuten)     Op 16 juni 2014 heeft de Staatssecretaris van Infrastructuur en Milieu op basis van de Bedieningsovereenkomst station Bleizo besloten over te gaan tot realisatie van de Vervoersknoop Bleizo. Deze bedieningsovereenkomst is aangegaan onder de opschortende voorwaarde van instemming door de raden van Zoetermeer en Lansingerland.    Om uitwerking te geven aan het realisatiebesluit is vervolgens een Realisatieovereenkomst Vervoersknoop Bleizo opgesteld. Zoetermeer is middels twee verschillende rollen bij deze realisatieovereenkomst betrokken:  1. Via de Gemeenschappelijke Regeling Bleizo (GRB) en het Stadsgewest Haaglanden (SGH) als opdrachtgever van de Vervoersknoop Bleizo.  2. Als opdrachtnemer van GRB en SGH om de Vervoersknoop Bleizo voor hun rekening en risico te realiseren.    Vanuit de eerste rol dient de gemeente Zoetermeer de Bedieningsovereenkomst en de Realisatieovereenkomst te bekrachtigen. Daarnaast vraagt GRB een garantstelling van maximaal € 9,5 mln van de gemeente Zoetermeer ter dekking van haar bijdrage aan de Vervoersknoop Bleizo.     Vanuit de tweede rol dient de gemeente Zoetermeer in te stemmen met de Realisatieovereenkomst Vervoersknoop Bleizo, waarmee gemeente Zoetermeer zich verplicht om de Vervoersknoop Bleizo in opdracht en voor rekening en risico van SGH en GRB te realiseren. Hiervoor is een uitvoeringskrediet van € 70,81 miljoen benodigd voor de voorbereiding en uitvoering. Dit uitvoeringskrediet wordt volledig gedekt vanuit bijdragen van GRB en SGH.    De raad is hiertoe bevoegd vanuit zijn budgettaire en kaderstellende rol. Aard van deze bespreking is oordeelsvormend: uitwisseling van inhoudelijke argumenten en daarop doorvragen om tot een goede weging te kunnen komen van de voorstellen.  Afhankelijk van de resultaat van deze bespreking wordt een afspraak gemaakt voor het vervolg; het streven is de besluitvorming te laten plaatsvinden in de raadsvergadering van 2 februari.|I: 20:40-21:30 : Vervoersknoop Bleizo (2014-000772) (oordeelsvormend) / Raadzaal|Agendapunt
gemeente-den-helder-den-helder-nh|1.  De vergadering is geannuleerd wegens een gebrek aan voldoende agendapunten.  |Verslag Raadscommissie Stadsontwikkeling en -Beheer 06 november 2017 19:30:00|Verslag
commissie-samenleving|Uitwerking moties en Plan van aanpak Stadhuis (2014-000892) (beeld- en oordeelsvormend) (50 minuten)     In de commissie Samenleving van 17 november 2014 en de raad van 1 december is het voorstel over de verkleining, renovatie en verduurzaming van het stadhuis behandeld. Tijdens de raadsbehandeling zijn vier moties aangenomen en is toegezegd dat er een plan van aanpak ter instemming aan de raad zou worden aangeboden.  Dit plan van aanpak ligt nu ter bespreking voor.     In het voorstel gaat het college in op de aanpak van de moties en vraagt het college de raad in te stemmen met het plan van aanpak “Het stadhuis vernieuwd”.    De bespreking vindt plaats in twee blokken.  In blok 1 is de aard van de bespreking beeldvormend; verkennen en afbakenen van het vraagstuk, inventariseren van knelpunten en keuzes, verhelderen van eventuele technische onduidelijkheden.  In blok 2 vindt een eerste oordeelsvormende ronde plaats.    Aan het einde van het tweede blok wordt een afspraak gemaakt voor het vervolgtraject.|3: 21:40-22:30 II. Uitwerking moties en Plan van aanpak Stadhuis (2014-000892) (beeld- en oordeelsvormend) |Agendapunt
gemeente-den-helder-den-helder-nh|1.  Opening en mededelingen   2.  Spreekrecht burgers   3.  Vaststelling agenda   4.  Voorstel tot het vaststellen van het beleidskader cultureel erfgoed 'Oog voor het verleden, visie op de toekomst'en de Erfgoedverordening gemeente Den Helder 2017.  Het beleidskader vormt het kader voor de gemeentelijke inzet op behoud en ontwikkeling van het erfgoed. In het kader wordt eerst een korte geschiedenis beschreven, daarna worden de ijkpunten van het cultureel erfgoed benoemd. Vervolgens wordt ingegaan op wat de gemeente wil met haar cultureel erfgoed, hoe ze dat wil bereiken en de rol van de gemeente en vrijwilligers. De Erfgoedverordening vormt het wettelijk kader voor bescherming. De commissie dient de raad te adviseren over het voorstel. 5.  Voorstel tot het vaststellen van het bestemmingsplan Willem Alexanderhof, uitbreiding fase 4.1 2017.  De wijk Willem Alexanderhof is nog in ontwikkeling. In het bestemmingsplan Julianadorp Oost 2011 zijn zes uitwerkingsgebieden opgenomen voor grond die na het vaststellen van het bestemmingsplan nader ingevuld worden. Het thans voorliggende bestemmingsplan voorziet in het ontwikkelen van de noordoost zijde van Willem-Alexanderhof en geeft invulling aan een tweetal van de eerder genoemde uitwerkingsgebieden. Het voorziet in het planologisch-juridisch kader voor de ontwikkeling van maximaal 62 grondgebonden woningen aan de noordzijde van de wijk. De commissie dient de raad te adviseren over het voorstel. 6.  Voorstel tot het vaststellen van het beleidsplan 'Ruimte voor water, gezamenlijk gemeentelijk rioleringsplan Noordkop 2018-2022.  Gemeenten zijn verplicht de zorgtaken voor afval-, hemel- en grondwater alsmede de onderbouwing van het tarief voor rioolheffing vast te leggen. Het voorliggende beleidsplan voorziet hierin. In het plan wordt aangegeven welke richting de gemeente op wil in de planperiode 2018-2022 en wordt een visie gegeven op de verdere toekomst. Door de vervangingsinvesteringen te activeren, kunnen de gelden in de rioolvoorziening worden benut voor de dekking van investeringen voor de zorgplichten hemel- en grondwater. Hierdoor kunnen de financiële consequenties voor de inwoners en bedrijven beperkt blijven. De commissie dient de raad te adviseren over het voorstel. 7.  Sluiting  |Verslag 2. Spreekrecht burgers|Verslag
stedelijke-commissie|Voorafgaand (parallel, zie overzicht):<br>19.00 tot 20.00 uur <br>B&W kamer: Werkgroep Duurzaamheid<br>Commissiekamer (b.g.): Werkgroep Meerjarenagenda Werk|enschede|Agenda
58c16d1dbb59056809b91917|19:00-19.50: Hoorzitting Vaststelling bestemmingsplan Stadscentrum-Oost/Cadenza VERVALLEN    20:00-20:30: Raadsvergadering    RAADZAAL:  20:40-21:30: Vervoersknoop Bleizo (2014-000772) (oordeelsvormend)   21:30-21:40: Pauze  21:40-22:30: Concept Woonvisie Zoetermeer en Notitie Samenspraak (2014-0008767 (vervolg beeldvorming)  22:30: Standpuntenlijst    BEDRIJFSRESTAURANT:  20:40-21:30:  Algemene aanpassing APV 2015 (2013-000832) (beeld- en oordeelsvormend) VERVALLEN   21:30-21:40: Pauze  21:40-22:30: Vervolg Algemene aanpassing APV 2015 (2013-000832) (beeld- en oordeelsvormend) VERVALLEN |zoetermeer|Agenda
gemeente-den-helder-den-helder-nh|1.  Opening en mededelingen.   2.  Spreekrecht burgers.   3.  Vaststelling agenda.   4.  Voorstel over het rapport ‘De Verplaatsing van Theater de Kampanje’ van de Rekenkamercommissie Den Helder.  De Rekenkamercommissie Den Helder heeft de afgelopen maanden onderzoek uitgevoerd naar de verplaatsing van Theater De Kampanje naar Willemsoord. De Rekenkamercommissie Den Helder doet in haar rapport een aantal aanbevelingen aan de gemeenteraad met het voorstel deze over te nemen. De commissie dient de raad over het voorstel te adviseren. 5.  Voorstel met betrekking tot de exploitatie van Theater De Kampanje.  Met de jaarstukken van 2016 werd duidelijk dat de bedrijfsvoering van Theater De Kampanje moet worden aangepast. Er is meer personele inzet nodig en de exploitatie kost meer dan van tevoren was ingeschat. Ook moeten de aanloopkosten volgend uit de verhuizing worden gedekt. Het college van burgemeester en wethouders wil een bijdrage aan De Kampanje doen van € 300.000,- voor compensatie van het verwachte tekort over 2017 en de subsidiebijdrage voor 2018 en 2019 verhogen met een bedrag van € 300.000,-. De commissie dient de raad te adviseren over het voorstel. 6.  Voorstel met betrekking tot de tweede tussenrapportage 2017 (behandeling is doorgeschoven naar 4 december 2017).  In de loop van het jaar ontstaan afwijkingen ten opzichte van de vastgestelde begroting. Met de tussenrapportage 2017 wordt hierin inzicht gegeven. De rapportage heeft een nadelig effect van € 240.000,-. Samen met het negatieve resultaat vanuit de eerste tussenrapportage is het verwachte tekort € 4.856.000,-. Bij de jaarrekening wordt het uiteindelijke resultaat bepaald. De raad wordt voorgesteld kennis te nemen van de tussenrapportage en de hieruit voortvloeiende begrotingswijziging vast te stellen. De commissie dient de raad hierover te adviseren. 7.  Schorsing.  De vergadering is geschorst en wordt voortgezet op maandag 4 december 2017.|Verslag Raadscommissie Bestuur en Middelen 29 november 2017 19:30:00|Verslag
cluster-sociaal|Griffie: Gijs Corten  College: wethouder Rogier Tetteroo|gouda|Agenda
gemeente-den-helder-den-helder-nh|1.  Opening en mededelingen.   2.  Spreekrecht burgers.   3.  Vaststelling agenda.   4.  Voorstel over het rapport ‘De Verplaatsing van Theater de Kampanje’ van de Rekenkamercommissie Den Helder.  De Rekenkamercommissie Den Helder heeft de afgelopen maanden onderzoek uitgevoerd naar de verplaatsing van Theater De Kampanje naar Willemsoord. De Rekenkamercommissie Den Helder doet in haar rapport een aantal aanbevelingen aan de gemeenteraad met het voorstel deze over te nemen. De commissie dient de raad over het voorstel te adviseren. 5.  Voorstel met betrekking tot de exploitatie van Theater De Kampanje.  Met de jaarstukken van 2016 werd duidelijk dat de bedrijfsvoering van Theater De Kampanje moet worden aangepast. Er is meer personele inzet nodig en de exploitatie kost meer dan van tevoren was ingeschat. Ook moeten de aanloopkosten volgend uit de verhuizing worden gedekt. Het college van burgemeester en wethouders wil een bijdrage aan De Kampanje doen van € 300.000,- voor compensatie van het verwachte tekort over 2017 en de subsidiebijdrage voor 2018 en 2019 verhogen met een bedrag van € 300.000,-. De commissie dient de raad te adviseren over het voorstel. 6.  Voorstel met betrekking tot de tweede tussenrapportage 2017 (behandeling is doorgeschoven naar 4 december 2017).  In de loop van het jaar ontstaan afwijkingen ten opzichte van de vastgestelde begroting. Met de tussenrapportage 2017 wordt hierin inzicht gegeven. De rapportage heeft een nadelig effect van € 240.000,-. Samen met het negatieve resultaat vanuit de eerste tussenrapportage is het verwachte tekort € 4.856.000,-. Bij de jaarrekening wordt het uiteindelijke resultaat bepaald. De raad wordt voorgesteld kennis te nemen van de tussenrapportage en de hieruit voortvloeiende begrotingswijziging vast te stellen. De commissie dient de raad hierover te adviseren. 7.  Schorsing.  De vergadering is geschorst en wordt voortgezet op maandag 4 december 2017.|Verslag 2. Spreekrecht burgers.|Verslag
gemeente-den-helder-den-helder-nh|1.  De vergadering is geannuleerd wegens een gebrek aan voldoende agendapunten.  |Verslag 1. De vergadering is geannuleerd wegens een gebrek aan voldoende agendapunten.|Verslag
cluster-bestuur|Fase  □□○    Twee lokale radiostations hebben zich gemeld om de licentie voor de lokale omroep te verkrijgen. Op 5 juli heeft de gemeenteraad aanvullende criteria voor de verstrekking van de zendmachtiging vastgesteld om het commissariaat voor de media te kunnen adviseren. Bij deze bijeenkomst zullen de twee omroepen zich aan de raad presenteren.     Belangstellenden worden van harte uitgenodigd om bij deze bijeenkomst op de publieke tribune aanwezig te zijn  |4: Presentatie lokale omroep|Agendapunt
gemeente-den-helder-den-helder-nh|1.  Opening en mededelingen.   2.  Spreekrecht burgers.   3.  Vaststelling agenda.   4.  Voorstel tot het vaststellen van de Programmabegroting 2018.  Het college van burgemeester en wethouders stelt de raad voor de programmabegroting 2018 vast te stellen en kennis te nemen van de meerjarenraming 2019-2021. Tevens wordt voorgesteld om in aansluiting op de programmabegroting 2018-2021, de bijlage ‘Nieuw beleid en meerjarig sluitende begroting 2018-2021’ vast te stellen, het programma ‘Gebiedsgerichte aanpak’ in te stellen en een krediet van € 6.402.000 beschikbaar te stellen voor de noodzakelijke (vervangings-)investeringen in 2018. De commissie dient de raad over het voorstel te adviseren. 5.  Voorstel tot het vaststellen van de Verordening op de heffing en invordering van leges 2018.  Voorgesteld wordt de leges te verhogen met 1,2% als gevolg van de loon- en prijsontwikkelingen. Met de aanpassing van een aantal tarieven dient nog te worden gewacht op vaststelling en publicatie hiervan door het Rijk. 6.  Voorstel tot het vaststellen van de Verordening op de heffing en invordering van afvalstoffenheffing 2018.  Voorgesteld wordt de afvalstoffenheffing te verhogen met € 20,04 voor éénpersoonshuishoudens en € 29,04 voor meerpersoonshuishoudens om de heffing kostendekkend te maken. 7.  Voorstel tot het vaststellen van de Verordening op de heffing en invordering van lijkbezorgingsrechten 2018.  Voorgesteld wordt de lijkbezorgingsrechten te verhogen met 1,2% als gevolg van de loon- en prijsontwikkelingen. 8.  Voorstel tot het vaststellen van de Verordening op de heffing en invordering van rioolheffing 2018.  Voorgesteld wordt de rioolheffing met € 27,00 te verlagen tot € 130,00. 9.  Voorstel tot het vaststellen van de Verordening op de heffing en invordering van toeristenbelasting 2018.  Voorgesteld wordt de toeristenbelasting te verhogen met 1,2% als gevolg van de loon- en prijsontwikkelingen. 10.  Voorstel tot het vaststellen van de Verordening op de heffing en invordering van precariobelasting 2018.  Voorgesteld wordt de precariorechten te verhogen met 1,2% als gevolg van de loon- en prijsontwikkelingen. 11.  Voorstel tot het vaststellen van de Verordening op de heffing en invordering van forensenbelasting 2018.  Voorgesteld wordt de forensenbelasting te verhogen met 1,2% als gevolg van de loon- en prijsontwikkelingen. 12.  Sluiting.  |Verslag 6. Voorstel tot het vaststellen van de Verordening op de heffing en invordering van afvalstoffenheffing 2018.|Verslag
commissie-samenleving-en-commissie-stad-plenair|Algemeen deel commissie Samenleving en commissie Stad plenair|zoetermeer|Agenda
gemeente-den-helder-den-helder-nh|1.  Opening en mededelingen.   2.  Spreekrecht burgers.   3.  Vaststelling agenda.   4.  Voorstel tot het vaststellen van de Programmabegroting 2018.  Het college van burgemeester en wethouders stelt de raad voor de programmabegroting 2018 vast te stellen en kennis te nemen van de meerjarenraming 2019-2021. Tevens wordt voorgesteld om in aansluiting op de programmabegroting 2018-2021, de bijlage ‘Nieuw beleid en meerjarig sluitende begroting 2018-2021’ vast te stellen, het programma ‘Gebiedsgerichte aanpak’ in te stellen en een krediet van € 6.402.000 beschikbaar te stellen voor de noodzakelijke (vervangings-)investeringen in 2018. De commissie dient de raad over het voorstel te adviseren. 5.  Voorstel tot het vaststellen van de Verordening op de heffing en invordering van leges 2018.  Voorgesteld wordt de leges te verhogen met 1,2% als gevolg van de loon- en prijsontwikkelingen. Met de aanpassing van een aantal tarieven dient nog te worden gewacht op vaststelling en publicatie hiervan door het Rijk. 6.  Voorstel tot het vaststellen van de Verordening op de heffing en invordering van afvalstoffenheffing 2018.  Voorgesteld wordt de afvalstoffenheffing te verhogen met € 20,04 voor éénpersoonshuishoudens en € 29,04 voor meerpersoonshuishoudens om de heffing kostendekkend te maken. 7.  Voorstel tot het vaststellen van de Verordening op de heffing en invordering van lijkbezorgingsrechten 2018.  Voorgesteld wordt de lijkbezorgingsrechten te verhogen met 1,2% als gevolg van de loon- en prijsontwikkelingen. 8.  Voorstel tot het vaststellen van de Verordening op de heffing en invordering van rioolheffing 2018.  Voorgesteld wordt de rioolheffing met € 27,00 te verlagen tot € 130,00. 9.  Voorstel tot het vaststellen van de Verordening op de heffing en invordering van toeristenbelasting 2018.  Voorgesteld wordt de toeristenbelasting te verhogen met 1,2% als gevolg van de loon- en prijsontwikkelingen. 10.  Voorstel tot het vaststellen van de Verordening op de heffing en invordering van precariobelasting 2018.  Voorgesteld wordt de precariorechten te verhogen met 1,2% als gevolg van de loon- en prijsontwikkelingen. 11.  Voorstel tot het vaststellen van de Verordening op de heffing en invordering van forensenbelasting 2018.  Voorgesteld wordt de forensenbelasting te verhogen met 1,2% als gevolg van de loon- en prijsontwikkelingen. 12.  Sluiting.  |Verslag 7. Voorstel tot het vaststellen van de Verordening op de heffing en invordering van lijkbezorgingsrechten 2018.|Verslag
commissie-stad|Ontslakken + Jongerenhuisvesting (beeldvormend – presentatie dhr. De Zeeuw)  Het toevoegen van extra jongerenwoningen aan de woningvoorraad in de stad is een belangrijk speerpunt voor Zoetermeer. Hiertoe wordt voor een viertal locaties een haalbaarheidsonderzoek gestart om op deze vier locaties door De Goede Woning Jongerenwoningen te laten ontwikkelen en te laten realiseren. De kaders en uitgangspunten worden middels samenspraak met de omgeving per locatie vastgesteld.   Om uitvoering te geven aan de raadsmotie van 1 juli 2013 ‘Investeringen op gang houden’ wordt voorgesteld de realisatie van circa 200 jongerenwoningen als pilotproject aan te wijzen voor het ontslakken. Zie ook het memo “Ontslakken door middel van pilotproject realisatie Jongerenwoningen” van 14 oktober 2014.  Prof.mr. Friso de Zeeuw zal tijdens de beeldvormende commissievergadering voorlichting geven over de landelijke pilot ontslakken en de voordelen en consequenties hiervan. Daarnaast wordt bij de uitvoering van het project gebruik gemaakt van de expertise van het landelijk actieteam ontslakken.  Aard van deze bespreking is beeldvormend: verkennen en afbakenen van het vraagstuk, inventariseren van knelpunten en keuzes, verduidelijken eventuele technische onduidelijkheden.  De oordeelsvormende bespreking is vooralsnog gepland op 1 juni a.s.|I: Jongerenwoningen (beeldvormend) |Agendapunt
commissie-samenleving|Spreektijd per fractie voor beeldvorming: 2 minuten     Tijdens de behandeling van de kadernota armoede is de motie ‘leren van ervaringen’ (1412-09, 15 december 2014) aangenomen. Deze motie vroeg om de instrumenten en doelstellingen van het armoedebeleid te evalueren en eventueel bijstellingen te doen. Daarnaast werd de motie ‘Top 3 gemeenten’ (1412-24) aangenomen, waarmee het college wordt opgedragen een voorstel te doen ten aanzien van de doelstellingen van het armoedebeleid waarop het college wil worden afgerekend.     Ter uitvoering hiervan is door een extern bureau een evaluatie opgesteld met een terugblik op eerdere beleidskeuzes alsmede een vooruitblik op het huidige armoedebeleid en zijn indicatoren uitgewerkt vanuit een raadsbrede ambitie om tot de top-3 te behoren. Het rapport schetst tevens ontwikkelrichtingen om het armoedebeleid toekomstbestendig maken.     De raad wordt gevraagd om het college de opdracht te geven om concreet invulling te geven aan de aanbevelingen uit het rapport en om de aanbevelingen en doelstellingen vast te stellen.     Aard van deze bespreking is oordeelsvormend; uitwisseling van inhoudelijke argumenten en daarop doorvragen om tot een goede weging te kunnen komen van de voorstellen. Besluitvorming is voorzien op 30 november.     Naar aanleiding van de commissiebehandeling op 16 november 2015 is een aangepast raadsvoorstel bij de stukken geplaatst.|2: 21:10 - 22:00 Goed op weg?! Terugblik en vooruitblik op het armoedebeleid in Zoetermeer (beeld- en oordeelsvormend)|Agendapunt
58c16d1dbb59056809b91917|RAADSVERGADERING - Resultatendebat|zoetermeer|Agenda
58c16744bb59056809b918fb|De raad voorstellen om  1. Wijziging 74 van de Welstandsnota vast te stellen|0: Wijziging 74 van de Welstandsnota|Agendapunt
stedelijke-commissie|1.	Aan de Raad voor te stellen in te stemmen met een lening van maximaal 650.000 euro aan HET Symfonieorkest voor het optimaliseren van zijn kantoorruimte in het Muziekcentrum.  2.	In het voorstel aan de Raad een keuze te maken tussen:  a.	Een leningstermijn van 20 jaar, waarmee rente en aflossing door NedSym uitkomt op een bedrag van rond 42.000 euro per jaar;  Of  b.	Een leningstermijn van 14 jaar, waarmee rente en aflossing door NedSym uitkomt op een bedrag van rond 50.000 euro per jaar.  |99.4: Lening aan HET Symfonieorkest voor het optimaliseren van zijn kantoorruimte in het Muziekcentrum|Agendapunt
gemeente-den-helder-den-helder-nh|1.  Deze vergadering is verschoven naar maandag 30 januari 2017.  |Verslag 1. Deze vergadering is verschoven naar maandag 30 januari 2017.|Verslag
58c16744bb59056809b918fb|"In de lokale gezondheidsnota ""Vitale coalities"" is het gemeentelijk gezondheidsbeleid voor de komende 4 jaar vastgelegd. De nota bestaat uit de regionale nota Lokaal gezondheidsbeleid ""Vitale coalities, betere gezondheid, meer participatie"" aangevuld met een lokale oplegnota met de verbijzonderingen voor Enschede. Kern van de nota zijn vitale coalities; verbindingen tussen gezondheid en ander (gemeentelijk) beleid om zo op beiden resultaat te boeken. In de nota zijn voor Enschede de volgende vitale coalities met gezondheid uitgewerkt; het convenant Gezond Meedoen met Menzis, de decentralisaties, jeugd, sport en groen."|X.12: Lokaal Gezondheidsbeleid 2013-2016|Agendapunt
