gemeente|data|titel|klassegemeente-den-helder-den-helder-nh|1.  Opening en mededelingen.   2.  Vaststelling agenda.   3.  Vaststelling vergaderverslag 31 oktober 2016.  Het verslag van 31 oktober 2016 wordt ter vaststelling aangeboden. 4.  Programma van eisen.  De commissie bespreekt de second opinion met betrekking tot het Programma van eisen. 5.  Volgende vergadering.  De commissie dient de datum en tijd van haar volgende vergadering vast te stellen. 6.  Rondvraag.   7.  Sluiting.  |Verslag 6. Rondvraag.|Verslag
gemeente-den-helder-den-helder-nh|1.  Opening en mededelingen.   2.  Vaststelling agenda.   3.  Vaststelling vergaderverslag 10 oktober 2016.  Het verslag van 10 oktober 2016 wordt ter vaststelling aangeboden. 4.  Programma van eisen.  Het Programma van eisen wordt u met een begeleidend memo aangeboden inclusief de stukken met betrekking tot kostenraming, notitie contractvormen, huisvestingsscenario’s tijdens de verbouwing en het advies met betrekking tot comfort en energieanalyse. De commissie bespreekt bovenstaande stukken. 5.  Volgende vergadering.  De commissie dient de datum en tijd van haar volgende vergadering vast te stellen. 6.  Rondvraag.   7.  Sluiting.  |Verslag Commissie Renovatie stadhuis 2016 31 oktober 2016 18:00:00|Verslag
gemeente-den-helder-den-helder-nh|1.  Opening en mededeling.   2.  Vaststelling agenda.   3.  Vaststelling vergaderverslag 19 september 2016.  Het verslag van 19 september 2016 wordt ter vaststelling aangeboden. 4.  Voortgang ontwikkelingen Programma van eisen.  De huidige voortgang met betrekking tot het Programma van eisen is vervat in een concept ruimtelijk en functioneel programma van eisen. Het document beschrijft onder andere het werkplekconcept, de benodigde faciliteiten en de ruimtelijke / functionele relaties. 5.  Memo trade-off contractvormen renovatie stadhuis.  De keuze voor de wijze van aanbesteden bepaalt mede op welke wijze het definitieve Programma van eisen en vervolgens de vraagspecificatie voor een aanbesteding worden opgesteld. Om na besluitvorming van de raad naar de volgende fase in de planning door te kunnen gaan is het van belang voor het einde van de huidige projectfase een beeld te hebben bij de gewenste aanbestedingsvorm. 6.  Ter informatie diverse projectaspecten.  Er wordt een mondelinge toelichting gegeven over diverse projectaspecten: overzicht inhuur adviseurs, commissie duurzaamheid, 2e bijeenkomst Purmerend, raadsinformatieavond. 7.  Volgende vergadering.  De commissie dient de datum en tijd van haar volgende vergadering vast te stellen. 8.  Rondvraag.   9.  Sluiting.  |Verslag 6. Ter informatie diverse projectaspecten.|Verslag
gemeente-den-helder-den-helder-nh|1.  Opening en mededeling.   2.  Vaststelling agenda.   3.  Vaststelling vergaderverslag 19 september 2016.  Het verslag van 19 september 2016 wordt ter vaststelling aangeboden. 4.  Voortgang ontwikkelingen Programma van eisen.  De huidige voortgang met betrekking tot het Programma van eisen is vervat in een concept ruimtelijk en functioneel programma van eisen. Het document beschrijft onder andere het werkplekconcept, de benodigde faciliteiten en de ruimtelijke / functionele relaties. 5.  Memo trade-off contractvormen renovatie stadhuis.  De keuze voor de wijze van aanbesteden bepaalt mede op welke wijze het definitieve Programma van eisen en vervolgens de vraagspecificatie voor een aanbesteding worden opgesteld. Om na besluitvorming van de raad naar de volgende fase in de planning door te kunnen gaan is het van belang voor het einde van de huidige projectfase een beeld te hebben bij de gewenste aanbestedingsvorm. 6.  Ter informatie diverse projectaspecten.  Er wordt een mondelinge toelichting gegeven over diverse projectaspecten: overzicht inhuur adviseurs, commissie duurzaamheid, 2e bijeenkomst Purmerend, raadsinformatieavond. 7.  Volgende vergadering.  De commissie dient de datum en tijd van haar volgende vergadering vast te stellen. 8.  Rondvraag.   9.  Sluiting.  |Verslag 9. Sluiting.|Verslag
gemeente-den-helder-den-helder-nh|1.  Opening en mededeling.   2.  Vaststelling agenda.   3.  Vaststelling vergaderverslag 17 augustus 2016.  Het verslag van 17 augustus 2016 wordt ter vaststelling aangeboden. 4.  Voorstel projectaanpak renovatie stadhuis, periode augustus - november 2016.  In de vergadering van 17 augustus 2016  is het voorstel projectaanpak renovatie stadhuis periode augustus - november voor kennisgeving aangenomen. Het voorstel ligt thans ter bespreking voor. 5.  Memo toelichting programma van eisen.  In de vergadering van 17 augustus 2016 is gevraagd naar extra informatie met betrekking tot een programma van eisen. In het memo wordt hierop een toelichting gegeven. 6.  Terugblik werkbezoeken Purmerend, Haarlem, Velserbroek  maandag 29 augustus 2016.  Voor de beeldvorming in het proces om te komen tot een adequate renovatie van het stadhuis is het van belang voorbeeldsituaties op locatie te bekijken. De commissieleden worden in de gelegenheid gesteld hun reactie te geven op het werkbezoek van vandaag. 7.  Volgende vergadering.  De commissie dient de datum en tijd van haar volgende vergadering vast te stellen. 8.  Rondvraag.   9.  Sluiting.  |Verslag 7. Volgende vergadering.|Verslag
gemeente-den-helder-den-helder-nh|1.  Opening en mededeling.   2.  Vaststelling agenda.   3.  Vaststelling vergaderverslag 17 augustus 2016.  Het verslag van 17 augustus 2016 wordt ter vaststelling aangeboden. 4.  Voorstel projectaanpak renovatie stadhuis, periode augustus - november 2016.  In de vergadering van 17 augustus 2016  is het voorstel projectaanpak renovatie stadhuis periode augustus - november voor kennisgeving aangenomen. Het voorstel ligt thans ter bespreking voor. 5.  Memo toelichting programma van eisen.  In de vergadering van 17 augustus 2016 is gevraagd naar extra informatie met betrekking tot een programma van eisen. In het memo wordt hierop een toelichting gegeven. 6.  Terugblik werkbezoeken Purmerend, Haarlem, Velserbroek  maandag 29 augustus 2016.  Voor de beeldvorming in het proces om te komen tot een adequate renovatie van het stadhuis is het van belang voorbeeldsituaties op locatie te bekijken. De commissieleden worden in de gelegenheid gesteld hun reactie te geven op het werkbezoek van vandaag. 7.  Volgende vergadering.  De commissie dient de datum en tijd van haar volgende vergadering vast te stellen. 8.  Rondvraag.   9.  Sluiting.  |Verslag 9. Sluiting.|Verslag
gemeente-den-helder-den-helder-nh|1.  Opening en mededeling.   2.  Vaststelling agenda.   3.  Vaststelling vergaderverslag 1 augustus 2016.  Het verslag van 1 augustus 2016 wordt ter vaststelling aangeboden. 4.  Voorstel projectaanpak renovatie stadhuis, periode augustus - november 2016.  Het college van burgemeester en wethouders biedt de commissie de planning voor de komende maanden ter bespreking aan. 5.  Werkbezoeken/excursies.  Voor de beeldvorming in het proces om te komen tot een adequate renovatie van het stadhuis is het van belang voorbeeldsituaties op locatie te bekijken. Bezien dient te worden hoe hieraan het best invulling kan worden gegeven. 6.  Volgende vergadering.  De commissie dient de datum en tijd van haar volgende vergadering vast te stellen. 7.  Rondvraag.   8.  Raadsvoorstel/-besluit Renovatieproces stadhuis.  Het voorstel vloeit voort uit de commissievergadering van 1 augustus 2016 en wordt thans ter kennis van de commissie gebracht. De besluitvorming met betrekking tot het voorstel vindt plaats in de raadsvergadering van 12 september 2016 door tussenkomst van de commissie Bestuur en Middelen van 29 augustus 2016. 9.  Sluiting.  |Verslag 1. Opening en mededeling.|Verslag
commissie-samenleving|Agenderingsverzoek brief Overleg Samenwerkende Ouderenbonden en reactie college (50 minuten)     Spreektijd per fractie: 1 minuut   In de raad van 6 juli jl. hebben de fracties van Zó!, SP, GroenLinks en CU/SGP verzocht om agendering van de brief van het Overleg Samenwerkende Ouderenbonden (OSO, dd 20 juni, nr 15/098). De fractie van D66 heeft daarnaast verzocht om een afschrift van de reactie van het college waarbij ook het advies van de WMO-raad betrokken wordt. Het college heeft op 9 juli jl. gereageerd op de brief van het OSO.|6: 22:10-23:00 III. Agenderingsverzoek brief Overleg Samenwerkende Ouderenbonden en reactie college |Agendapunt
58c16744bb59056809b918fb|collegevoorstel aan de raad:  Wij stellen u voor te besluiten om:    	1.	een eenmalige extra bijdrage ad € 50.000 te leveren aan VV Rigtersbleek ter realisatie van een nieuw te bouwen kleedgebouw.    2.	De bijdrage te dekken uit het budget van Speelvoorzieningen binnen het programma Opgroeien en Ontwikkelen.  |5: Raadsvoorstel Kleedvoorziening sportpark Rigtersbleek ¿ stuknummer 16962 _ de beantwoording art. 38 vragen dhr. vd Vloet inzake rigtersbleek|Agendapunt
58c16d1dbb59056809b91917|Locatie: Drijvend Paviljoen te Rotterdam   Tijd: 13:00 - 17:30 uur   Aanmelden: Officiële uitnodiging volgt half december en dan kan er worden aangemeld|Gemeente Amstelveen |Uitnodigingen
commissie-stad|De vervoersautoriteit Metropoolregio Rotterdam – Den Haag (MRDH) is opdrachtgever voor de concessies voor het railvervoer in de Rotterdamse en de Haaglandse regio’s. Beide concessies eindigen in december 2016. Momenteel vinden de voorbereidingen voor de nieuwe concessies plaats. Onderdeel daarvan is het opstellen van een Programma van eisen, dat beschrijft welke eisen de opdrachtgever stelt aan het railvervoer in de nieuwe concessieperiode (2016-2026). Voor beide railconcessies heeft de Bestuurscommissie van de vervoersautoriteit MRDH het ontwerp-Programma van eisen vastgesteld. Voorheen gebeurde dit afzonderlijk in de Stadsregio Rotterdam en Stadsgewest Haaglanden. De Bestuurscommissie heeft er naar gestreefd beide concessie zoveel mogelijk eenvormig te maken.   De raad wordt voorgesteld de bijgevoegde zienswijze op de ontwerp Programma van eisen railconcessies Rotterdam en Haaglanden vast te stellen en in te dienen bij de vervoersautoriteit MRDH.   Aard van deze bespreking is beeldvormend: verkennen en afbakenen van het vraagstuk, inventariseren van knelpunten en keuzes, verduidelijken eventuele technische onduidelijkheden.   De zienswijze moet uiterlijk 28 september zijn ingediend bij de vervoersautoriteit.   Vaststelling van de zienswijze is gepland voor de raad van 14 september.|II: Zienswijze op het concept-programma van eisen voor de railconcessie Rotterdam en Haaglanden 2016 (beeldvormend) |Agendapunt
gemeente-den-helder-den-helder-nh|Besluitenlijst vergadering commissie Maatschappelijke ontwikkeling van 6 november 2017 met uitloop op 4 december 2017 (BSL17.0048) Aanwezig: C.P.J. Jansen en H. Nuninga (Stadspartij Den Helder), A. Hogendoorn (VVD), G. de Vries-Schong (D66), R. Post en E. Dieleman (Sociaal Lokaal Den Helder), G. Duijvelshoff-Ufkes en S.H.M. Houtveen (CDA), B.P. Spandaw en A.J. Pruiksma (PvdA), T.C. Polonius-Padmore en J.M. van Dam-van der Sterre (ChristenUnie), C.J. Dol-Cremers en M. Boessenkool (GroenLinks), N. de Haan en J. van der Kraan (Behoorlijk Bestuur), D.R. Pastoor en M.J. Driehuis-Jak (Vrije Socialisten), M. Vermooten en R. Duijnker (fractie Vermooten) en J.E. Vorstman-Gorter en P. Koopman (Beter voor Den Helder). Voorzitter: Commissiegriffier: Wethouder: F.C. Klut M. Versteeg P.J.R. Kos 1. Opening en mededelingen. De voorzitter opent de vergadering. Wethouder van der Paard is wegens omstandigheden afwezig en wordt waargenomen door wethouder Kos. 2. Spreekrecht burgers. Van het spreekrecht is geen gebruik gemaakt. 3. Vaststelling agenda. De agenda is ongewijzigd vastgesteld. De voorzitter vraagt om enige vergaderdiscipline gezien de volle agenda van de commissie. Ter advisering 4. Rapport 'Gemeenschappelijke Regeling Gesubsidieerde Arbeid Kop van Noord-Holland' van de Rekenkamercommissie Den Helder. De commissie acht het voorstel unaniem besluitrijp en adviseert het voorstel te agenderen als hamerpunt voor de raadsvergadering van 20 november 2017. Wethouder Kos zegt toe een aantal vragen van de fractie van de VVD schriftelijk te zullen beantwoorden. 5. Voorstel tot het vaststellen van het 'Beleidsplan schulddienstverlening 2018-2021: Schulden? Samen investeren in innovatieve oplossingen'. De fractie van het CDA doet een ordevoorstel het voorstel niet door te geleiden naar de gemeenteraad. De reden hiervan is dat de fractie het voorstel niet besluitrijp acht. De stemmen staken over het ordevoorstel waarmee het niet is aangenomen. De fracties van de VVD, het CDA, Sociaal Lokaal Den Helder, GroenLinks, Behoorlijk Bestuur en de Vrije Socialisten hebben voor het voorstel gestemd. De overige fracties tegen. De commissie acht het voorstel besluitrijp en besluit in meerderheid het voorstel te agenderen als bespreekpunt voor de raadsvergadering van 20 november 2017. Bespreekpunten hierbij zijn onder meer: - de financiële onderbouwing; - privacy; - benutting van voorzieningen; - overleg met netwerkpartners; - speerpunten ten aanzien van de visie. De fractie van D66 heeft aangegeven in dit verband een amendement te overwegen. Wethouder Kos zegt toe de randvoorwaarden voor uitwisseling van persoonsgegevens aan de commissie te doen toekomen. De voorzitter stelt de commissie voor, gezien het tijdstip en de nog te behandelen agendapunten, de vergadering te schorsen en deze op een andere dag te hervatten. Een meerderheid van de commissie stemt hiermee in. De fracties van de Stadspartij Den Helder, Beter voor Den Helder en Behoorlijk Bestuur stemmen tegen het voorstel, de overige fracties voor. Wethouder Kos verzoekt de commissie eventuele vragen over de resterende agendapunten op voorhand toe te zenden zodat een degelijke beantwoording kan worden voorbereid. De voorzitter schorst de vergadering (22.18 uur). De vergadering is voortgezet op maandag 4 december 2017, aanvang 19.30 uur. Ten opzichte van 6 november 2017 zijn de volgende wijzigingen in de bemensing van de vergadering: Afwezig: C.P.J. Jansen (Stadspartij), R. Post (Sociaal Lokaal Den Helder), B.P. Spandaw (PvdA), M. Boessenkool (GroenLinks), M.J. Driehuis-Jak (Vrije Socialisten), M. Vermooten en R. Duijnker (fractie Vermooten) en P. Koopman (Beter voor Den Helder), F.C. Klut (voorzitter). Aanwezig: R.N. Bruin (VVD), J. Vlaming (Sociaal Lokaal Den Helder) en J. Klopstra (voorzitter). 6. Verbeter- en ontwikkelplan zorg en ondersteuning kwetsbare gezinnen. De commissie bespreekt het verbeter- en ontwikkelplan zorg en ondersteuning kwetsbare gezinnen. Wethouder Kos spreekt daarbij de ambitie uit dat alle in het plan genoemde punten medio 2018 zijn uitgevoerd. Verder zegt wethouder Kos toe de rapportage van de vijf samenwerkende Rijksinspecties te zullen toesturen aan de commissie. De volgende rapportage over het verbeter- en ontwikkelplan zal in het tweede kwartaal van 2018 worden behandeld in de commissie. 7. Bestuursrapportage Sociaal Domein tweede kwartaal 2017 De commissie bespreekt de kwartaalrapportage. 8. Bestuursrapportage Sociaal Domein derde kwartaal 2017 De commissie bespreekt de kwartaalrapportage. Wethouder Kos zegt de commissie toe een vergelijking jte sturen tussen het derde kwartaal 2016 en het derde kwartaal 2017. 9. Sluiting De voorzitter sluit de vergadering (21:10 uur).|Besluitenlijst Raadscommissie Maatschappelijke Ontwikkeling 06 november 2017 19:30:00|Besluitenlijst
58c16d1dbb59056809b91917|Aanmelden vóór 7 april 2016 bij m.j.janssen@zoetermeer.nl  |burgemeester Aptroot|Uitnodigingen
commissie-samenleving-en-commissie-stad-plenair|Drie keer per jaar wordt aan de raad gerapporteerd over de afhandeling van de aanvaarde moties. U ontvangt het  overzicht van moties waarbij de raad wordt voorgesteld de motie als afgedaan te beschouwen alsmede een overzicht van de nog openstaande moties.          Aard van deze bespreking is oordeelsvormend; uitwisseling van inhoudelijke argumenten en daarop doorvragen om tot een goede weging te kunnen komen van de voorstellen.         Besluitvorming is voorzien op 3 oktober.|7: Afdoening moties|Agendapunt
58c16d1dbb59056809b91917|Op 10 april 2017 in de raadzaal van 12:00 tot 13:30 uur  Aanmelden bij Maarten ter Hoeve per mail: m.ter.hoeve@zoetermeer.nl|Griffie|Uitnodigingen
commissie-samenleving-en-commissie-stad-plenair|De raad wordt gevraagd in te stemmen met de zienswijze op het Treasury statuut 2016 van de Metropoolregio Rotterdam Den Haag (MRDH).  Dit voorstel betreft de zienswijze op het aangepaste treasury-statuut van de MRDH en twee financieringsvoorstellen. Dit betreft leningen aan de HTM en de RET voor de bekostiging van materieel en infrastructuur. Omdat dit een financieel risico voor de MRDH inhoudt, moet de weerstandreserve van de MRDH worden verhoogd. Dit wordt gevoed uit een opslag op de rente die HTM en RET moeten betalen.  De hoofdlijn van de zienswijze is dat ingestemd kan worden met de voorgelegde stukken. In de zienswijzebrief wordt wel aandacht gevraagd voor de samenloop en samenhang van toekomstige (zienswijze-)procedures vanuit de MRDH. Gevraagd wordt deze meer te bundelen, zodat voor de raden de onderlinge verbanden duidelijk worden.  |6.a: Zienswijze concept Treasurystatuut 2016 MRDH|Agendapunt
commissie-samenleving|Oriënterende bespreking<br>Op de vraag naar de werving van vrouwelijke kandidaten voor het bestuur antwoordt de wethouder dat ook hier geen vrouwelijke kandidaten zich hebben gemeld. Aangedrongen wordt de vacature voor het 5de lid van de Raad van Toezicht met een vrouw in te vullen.<br><br>Meningsvormende bespreking<br>De commissie adviseert de raad het voorstel als hamerstuk te behandelen.|8: Benoeming leden van de Raad van Toezicht St. Allure (IVR-12-00599)|Agendapunt
commissie-samenleving|Presentatie Exploitatie gemeentelijke begraafplaatsen (50 minuten)     Op 18 februari jl. (via de dagmail) heeft u een memo ontvangen van het college over de exploitatie van de gemeentelijke begraafplaatsen.  Omdat de exploitatie van de begraafplaatsen niet kostendekkend is, dient een onderzoek te worden gedaan naar de mogelijkheden om de begraafplaatsen wel kostendekkend te maken.  De financiële vertaling hiervan wordt vervolgens meegenomen in het begrotingsdebat in het najaar.     Aan de hand van een presentatie, wordt de raad mee te denken over oplossingsrichtingen en hiervoor input mee te geven.|3: 21:40-22:30 II. Presentatie Exploitatie gemeentelijke begraafplaatsen |Agendapunt
commissie-samenleving-en-commissie-stad-plenair|Volgens het protocol geheimhouding en besloten vergaderingen 2012 ontvangt de raad tweemaal per jaar van het college een openbaar overzicht van alle stukken waarop in de voorafgaande periode geheimhouding is opgelegd. Het overzicht is inmiddels aan de raad ter beschikking gesteld.    Op advies van het college dient de raad vervolgens te beslissen op welke van die stukken de geheimhouding kan worden opgeheven. In dit voorstel gaat het om de geheime stukken vanaf 1 augustus 2012 tot 1 augustus 2016.  |6.e: Overzicht geheime stukken en besluit geheimhouding - september 2016|Agendapunt
58c16a1bbb59056809b91909|Stemverklaring:<br>Dhr. Burger is het eens met de begrotingswijzigingen, maar uit daarbij zorg over het feit dat de post onvoorzien op nul staat terwijk het eerste kwartaal nauwelijks voorbij is. Dat is geen goede zaak. Hij vraag om bij de voorjaarsnota een geactualiseerd beeld te overleggen. <br>Wethouder Kuipers zegt dit toe.<br><br>Dhr. Braaksma geeft aan dat meerdere keren gevraagd is om met een overzicht van begrotingswijzigingen 2012 te komen. Kan dit nu wel gedaan gaan worden?<br>Wethouder Kuipers zegt dit toe.|11: Begrotingswijzigingen (IVR-12-00706)|Agendapunt
commissie-samenleving|Wethouder Zwagerman zegt het volgende:<br>Dorpshuizen<br>1. Het rapport met betrekking tot het onderzoek naar verzelfstandigingsmogelijkheden voor de dorpshuizen is klaar. Als dit besproken is in het college zal het naar de raad toekomen met een informatienota (naar verwachting zal dit begin mei 2012 zijn). <br>2. Met de dorpshuizen zullen afzonderlijke gesprekken gevoerd worden over de eigen situatie en de mogelijke veranderingen daarin. Sfeer en stemming zijn positief.<br>3. Aandacht is er voor de levensvatbaarheid van de dorpshuizen ook in de toekomst. De situatie per dorpshuis verschilt.<br>4. Dorpshuis De Schoof in Wervershoof heeft een contract met de Woonschakel en heeft daarom financiële zekerheid vanuit de gemeente nodig. De subsidies worden per jaar bepaald. Alleen voor de Stoomtram is hierop een uitzondering gemaakt, omdat dit in samenspraak met Hoorn werd gedaan. <br>5. In De Schoof zit sociaal cultureel werk. Dit is niet het geval in andere dorpshuizen. Per dorpshuis wordt gekeken naar de situatie. <br>6. Vrijwilligers die besturen zijn kwetsbaar, omdat zij geen achterban hebben en wel te maken hebben met zeurende mensen. Deze mensen moeten gekoesterd worden. Er wordt een zorgvuldig proces doorlopen en in goed overleg wordt geprobeerd tot oplossingen te komen.<br>7. Als er geen sprake meer is van een subsidierelatie, dan betekent dit dat het betreffende gebouw in het bezit is van de betreffende stichting. Dan moet een bruidsschat meegegeven worden zoals dat ook gebeurd is met het onderwijs dat verzelfstandigde.<br>8. Als het bestaansrecht van een dorpshuis ter discussie staat, zal dit aan de politiek voorgelegd worden voor besluitvorming.<br>9. De dorpshuizen zijn op de hoogte van de situatie met betrekking tot subsidieverstrekking. Hierover zijn informatieavonden gehouden. <br>10. Gekeken is naar verschillende modellen, zoals bijvoorbeeld het cafetariamodel dat niet bleek te werken. Nu blijkt dat verenigingen zich inspannen om zaken onderling voor elkaar te krijgen.<br>11. Op dit moment ligt er een verzoek van dorpshuis Abbekerk om een investering te doen. Het dorpshuis van Sijbekarspel is net opgeknapt. Verder zijn de dorpshuizen in goede staat en is er geen achterstallig onderhoud.<br><br>Zwembaden<br>Jaarlijkse overleggen worden gevoerd. Daarin wordt ook gesproken over mogelijke wijzigingen in de toekomst. Er zijn vrijwilligers aan het werk bij de zwembaden die geen werk hebben en zich op deze manier nuttig willen maken. Positieve gesprekken zijn gevoerd.|4: Actieve informatie college|Agendapunt
commissie-stad-en-ruimte|Stukken volgen nog|10: Stand van zaken bestemmingsplan Noordgebouw (tussenuitspraak Raad van State) |Agendapunt
58c16d1dbb59056809b91917|Inclusief afscheid huidige voorzitter, dhr. K. v.d. Hende|7.a: Benoeming voorzitter rekenkamercommissie|Agendapunt
adviescommissie-sociaal-bestuurlijk|Op verzoek van D66.  De fractie wil weten wat de wethouder doet met de suggesties die gedaan worden. |6.1.08: B-II  Brief van het Erfgoedplatform van kunsten '92 over verkiezingsprogramma|Agendapunt
58c16a1bbb59056809b91909|Voor besluitvorming inclusief stemverhoudingen zie bijlage 2 bij het verslag.<br>De amendementen zijn bijgevoegd als bijlagen in volgorde van het overzicht in bijlage 2.<br><br>Stemverklaring met betrekking tot voorstel:<br>Dhr. Plekker geeft aan dat GemeenteBelangen zich niet kan vinden in de voorjaarsnota en de kadernota, omdat er teveel bezuinigd wordt op de kleine kernen en vorozieningen. Er zou meer binnen de eigen organisatie gekeken moeten worden naar bezuinigingen.<br>Mevr. Keur vraagt dhr. Plekker dan met alternatieve dekking te komen.<br>Dhr. Plekker antwoordt dat GemeenteBelangen dat gedaan heeft.<br><br>De raad besluit conform het voorstel waarbij GemeenteBelangen geacht wordt te hebben tegengestemd.|9: Vaststellen Voorjaarsnota 2011 en Kadernota 2012-2015 (IVR-11-00326)|Agendapunt
adviescommissie-sociaal-bestuurlijk|Op verzoek van de fractie van D66. De fractie wil van de overige fracties horen hoe die denken over kermissen in kerndorpen.|6.1.09: B-II Antwoord op de artikel 41 vragen van over de Herpse kermis 2017|Agendapunt
adviescommissie-sociaal-bestuurlijk|Op verzoek van de fractie van D66. De fractie wil weten wat de wethouder doet met de suggesties die gedaan worden. |6.1.10: B-II Bouwend Nederland over inspiratie voor partijprogramma Gemeenteraadsverkiezingen 2018|Agendapunt
gemeente-utrecht-utrecht-ut|Cie M&S Vrijmarkt Koningsdag 2016|Cie M&S Vrijmarkt Koningsdag 2016|Commissiebrieven M&S
gemeente-oude-ijsselstreek-oude-ijsselstreek-gld|0.1.  Opening en mededelingen   0.2.  Vaststellen conclusies en afspraken vorige vergadering   13.  Jaarrekening 2015, 1e bestuursrapportage 2016 (berap) en voorjaarsnota 2017   0.3.  Sluiting  |Verslag 13. Jaarrekening 2015, 1e bestuursrapportage 2016 (berap) en voorjaarsnota 2017|Verslag
gemeente-oude-ijsselstreek-oude-ijsselstreek-gld|0.1.  Opening en mededelingen   0.2.  Vaststelling van de agenda   6.  NOG TOEVOEGEN AAN AGENDA: Begroting 2017 en jaarrekening 2015 Erfgoedcentrum Achterhoek Liemers (ECAL)  N.a.v. commissie AFE 13 juni 2016 op voorstel van lid Van de Beek toe te voegen aan agenda MO. 0.3.  Vaststellen conclusies en afspraken vorige vergadering   7.  Actieplan huisvesting en integratie statushouders   2.  voorstel: Zienswijze bij Oprichting St. Veilig Thuis Noord Oost Gelderland  zie conclusies en afspraken info-bijeenkomst 9 juni 9.  Aanpassen Gemeenschappelijke Regeling GGD NO Gelderland   10.  Jaarrekening 2015 en begroting 2017 GGD NO Gelderland   11.  Jaarrekening 2015 en begroting 2016 en begroting 2017 Laborijn   12.  Memo pilot buurtbudgetten   0.4.  Lijst van bestuurlijke toezeggingen commissie MO en actuele moties   0.5.  Rondvraag en sluiting  |Verslag 10. Jaarrekening 2015 en begroting 2017 GGD NO Gelderland|Verslag
